	selection	cdr_title_num	cdr_track_num	composer_name	artist_name	track_name	track_id	popularity	year_rec	danceability	energy	valence	key	loudness	mode	speechiness	acousticness	instrumentalness	liveness	tempo	norm_energy	norm_valence	quadrant	num_users	1	2	3	4	tenderness	sadness	joy	transcendence	power	tension	fear	peace	bitterness	anger	surprise	txt_free	txt_quad	txt_mood	pref	fam
344	latam	HEX0544	HEX0544-0007	Camilo Azuquita	not found	Solo Importas Tu	11JfJ63RonbdtFQ8tEBpWu	9	1999	0.598	0.849	0.964	0	-8.001	1	0.0469	0.376	0.158	0.117	192.764	1.32088878422764	0.983593632206787	1	0.0	0.0	0.0	0.0	0.0	0.0	0.0	0.0	0.0	0.0	0.0	0.0	0.0	0.0	0.0	0.0				0.0	0.0
345	latam	HEX10541	HEX10541-0003	Bush Y Sus Magnificos	not found	Nana Nina	2OrPq0v21iGJeljlu67YlL	0	2011	0.482	0.912	0.919	5	-4.242	1	0.0471	0.208	0.00988	0.11	123.74	1.6305868611344	0.783736925753765	1	0.0	0.0	0.0	0.0	0.0	0.0	0.0	0.0	0.0	0.0	0.0	0.0	0.0	0.0	0.0	0.0				0.0	0.0
346	latam	HEX10541	HEX10541-0011	Los Caballeros de Colon	not found	Con Los Caballeros	4knuVftCcT8ZgPjor7LZWc	0	2011	0.636	0.884	0.928	0	-6.663	1	0.0823	0.349	0.093	0.181	115.349	1.49294327139806	0.823708267044369	1	1.0	1.0	0.0	0.0	0.0	0.0	0.0	1.0	0.0	0.0	0.0	0.0	0.0	0.0	0.0	0.0	alegria	Fast_tempo Keep_beat_with_fingers_or_feetArticulation_of_notes	Emotion_is_contagious	0.9900990099009901	0.0
347	latam	HEX10900	HEX10900-0010	Yin Carrizo	not found	20 De Enero En Ocu	2s6vrMQbwNlA54vaD1Pzby	9	                         2015-05-08	0.578	0.91	0.915	0	-5.679	1	0.174	0.558	9.22e-06	0.0815	101.463	1.62075517615323	0.765971885180163	1	2.0	2.0	0.0	0.0	0.0	0.0	0.0	1.0	0.0	1.0	0.0	0.0	0.0	0.0	0.0	0.0	alegre festiva	High_sound_level Fast_tempo High_sound_level Fast_tempoMelody_contour Consonance Keep_beat_with_fingers_or_feet	Want_to_dance_or_move Timbre Articulation_of_notes	0.0	0.0
348	latam	HEX11900	HEX11900-0004	Fania All Stars	Rubén Blades	Los Muchachos De Belén	7JaEJfVjH3zxDt2TbT2huT	8	                         2008-03-11	0.571	0.751	0.953	10	-8.685	1	0.0335	0.421	1e-06	0.036	101.967	0.839136220150458	0.934739770629381	1	0.0	0.0	0.0	0.0	0.0	0.0	0.0	0.0	0.0	0.0	0.0	0.0	0.0	0.0	0.0	0.0				0.0	0.0
349	latam	HEX7450	HEX7450-0004	Rubén Blades	not found	Bochinches	73ANLNXVPbbmG49KfNQSZs	13	2002	0.463	0.774	0.485	5	-5.84	0	0.0585	0.116	0.168	0.0705	84.822	0.952200597433878	-1.14376997648205	2	0.0	0.0	0.0	0.0	0.0	0.0	0.0	0.0	0.0	0.0	0.0	0.0	0.0	0.0	0.0	0.0				0.0	0.0
350	latam	HEX7450	HEX7450-0013	Rubén Blades	not found	La Ruta	5rL1drPOBVezRYd1DGtrIY	11	2002	0.601	0.749	0.431	7	-5.422	1	0.218	0.475	0.000488	0.574	177.967	0.829304535169293	-1.38359802422567	2	1.0	1.0	0.0	0.0	0.0	0.0	0.0	0.0	0.0	0.0	0.0	0.0	0.0	0.0	0.0	1.0	Sentida	Note_durations Goosebumps_or_chillsLyrics Keep_beat_with_fingers_or_feet	Left_me_in_awe Keep_beat_with_fingers_or_feet	0.0	0.0
351	latam	HEX7450	HEX7450-0014	Rubén Blades	not found	A San Patricio	51kQ6VB2VWamhSIN3NuYQj	11	2002	0.8	0.737	0.521	2	-7.922	1	0.0393	0.735	1.51e-05	0.0848	110.02	0.77031442528229	-0.98388461131963	2	0.0	0.0	0.0	0.0	0.0	0.0	0.0	0.0	0.0	0.0	0.0	0.0	0.0	0.0	0.0	0.0				0.0	0.0
352	latam	HEX7730	HEX7730-0003	Gabino Pampini	not found	Ponte en Ritmo	3UZtFUg01cnertcNgs6sbM	5	                         2015-07-01	0.884	0.819	0.874	2	-6.042	1	0.0634	0.322	0.000197	0.181	97.092	1.17341350951013	0.583880219300743	2	0.0	0.0	0.0	0.0	0.0	0.0	0.0	0.0	0.0	0.0	0.0	0.0	0.0	0.0	0.0	0.0				0.0	0.0
353	latam	HEX7730	HEX7730-0009	Gabino Pampini	not found	La Fiesta No Es para Feos	1CFS6FGOPCampxaV4DlCcN	0	                         2015-07-01	0.812	0.812	0.911	0	-4.861	1	0.0416	0.415	6.72e-06	0.0732	109.462	1.13900261207605	0.74820684460656	2	0.0	0.0	0.0	0.0	0.0	0.0	0.0	0.0	0.0	0.0	0.0	0.0	0.0	0.0	0.0	0.0				0.0	0.0
354	latam	HEX0293	HEX0293-0009	Azuquita	not found	Tu mi Delirio	6lULGHtqjzXS3EHWClNytx	0	                         1994-01-01	0.624	0.241	0.458	10	-14.062	1	0.0335	0.618	0.00825	0.193	76.963	-1.6679434500471	-1.26368400035386	3	0.0	0.0	0.0	0.0	0.0	0.0	0.0	0.0	0.0	0.0	0.0	0.0	0.0	0.0	0.0	0.0				0.0	0.0
355	latam	HEX10900	HEX10900-0022	Los Invasores	not found	El Raton	2WFimSbDajGIXOtEK90Vko	18	                         2015-06-18	0.746	0.37	0.493	8	-7.07	1	0.0531	0.48	0.0	0.094	96.546	-1.03379976876184	-1.10823989533484	3	0.0	0.0	0.0	0.0	0.0	0.0	0.0	0.0	0.0	0.0	0.0	0.0	0.0	0.0	0.0	0.0				0.0	0.0
356	latam	HEX2643	HEX2643-0005	Rubén Blades	not found	Te Odio Y Te Quiero	1PTPEHk6NKEYthcuWaLcBy	2	                         1988-01-01	0.579	0.345	0.288	9	-15.973	1	0.043	0.41	0.0	0.242	84.816	-1.15669583102643	-2.01869822473194	3	2.0	0.0	0.0	2.0	0.0	0.0	2.0	0.0	0.0	0.0	0.0	0.0	0.0	0.0	0.0	0.0	Melancolica emotiva	Melody_contour Slow_tempo Harmony Note_durationsLow_sound_level Timbre Melody_contour	Melody_contour Lyrics	0.49751243781094534	0.0
357	latam	HEX2643	HEX2643-0008	Rubén Blades	not found	Duele	2GjHifn5Qe44dDF6B9HJ4r	6	                         1988-01-01	0.487	0.327	0.143	0	-13.09	1	0.0357	0.294	0.00148	0.0865	82.53	-1.24518099585693	-2.66268094552501	3	0.0	0.0	0.0	0.0	0.0	0.0	0.0	0.0	0.0	0.0	0.0	0.0	0.0	0.0	0.0	0.0				0.0	0.0
358	latam	HEX2643	HEX2643-0003	Rubén Blades	not found	Tú Me Acostumbraste	4Tt6EeVcTvh0tUYVOnEQEd	2	                         1988-01-01	0.59	0.309	0.297	2	-17.182	1	0.0313	0.52	0.00781	0.116	90.019	-1.33366616068743	-1.97872688344134	3	0.0	0.0	0.0	0.0	0.0	0.0	0.0	0.0	0.0	0.0	0.0	0.0	0.0	0.0	0.0	0.0				0.0	0.0
359	latam	KHX0927	KHX0927-0003	Los De Azuero	not found	La Junta	1Ty4GqWwMNuZBzy0FI8rsm	1	                         1999-01-01	0.734	0.118	0.894	9	-21.876	1	0.153	0.845	2.43e-05	0.0697	121.503	-2.27259207638887	0.672705422168752	4	0.0	0.0	0.0	0.0	0.0	0.0	0.0	0.0	0.0	0.0	0.0	0.0	0.0	0.0	0.0	0.0				0.0	0.0
360	latam	KHX0927	KHX0927-0011	Los De Azuero	not found	Que Solita Me Has Dejado	1TdcXz6wTGVP5YIihBpt7v	1	                         1999-01-01	0.554	0.323	0.904	7	-19.131	0	0.0556	0.733	0.0	0.202	101.248	-1.26484436581926	0.717118023602757	4	0.0	0.0	0.0	0.0	0.0	0.0	0.0	0.0	0.0	0.0	0.0	0.0	0.0	0.0	0.0	0.0				0.0	0.0
361	latam	KHX0927	KHX0927-0023	Los De Azuero	not found	Julia Pela La Yuca	59dydOBXDR2ZlbkUtQAINn	6	                         1999-01-01	0.598	0.455	0.92	3	-18.258	1	0.0494	0.442	0.0	0.243	100.093	-0.615953157062245	0.788178185897165	4	0.0	0.0	0.0	0.0	0.0	0.0	0.0	0.0	0.0	0.0	0.0	0.0	0.0	0.0	0.0	0.0				0.0	0.0
362	latam	HEX4424	HEX4424-0008	Azuquita	Papo Lucca	Paris de Noche	6ii2uW4hiwZvge4aIV2qyQ	2	                         1996-01-01	0.813	0.413	0.939	0	-14.657	1	0.0511	0.165	0.00156	0.065	134.334	-0.82241854166675	0.872562128621775	4	0.0	0.0	0.0	0.0	0.0	0.0	0.0	0.0	0.0	0.0	0.0	0.0	0.0	0.0	0.0	0.0				0.0	0.0
363	latam	HEX4424	HEX4424-0001	Azuquita	Papo Lucca	Mujer Celosa	4XXPUMw5HXzcjjvcc4kWjo	9	                         1996-01-01	0.784	0.407	0.922	0	-17.173	1	0.0681	0.662	0.000767	0.0667	87.444	-0.85191359661025	0.797060706183966	4	1.0	1.0	0.0	0.0	0.0	0.0	0.0	1.0	0.0	0.0	0.0	0.0	0.0	0.0	0.0	0.0	Alegre	Timbre Melody_contour ConditionedFacial_expressions Memories_of_somebody/something	Visualize_a_mental_image Keep_beat_with_fingers_or_feet	0.9900990099009901	0.0
364	latam	HEX7428	HEX7428-0016	Los Locos	not found	El Venao	1ywE8VIAW3oN6SlNOWQx1m	0	                         2018-08-03	0.742	0.932	0.913	1	-9.984	0	0.0445	0.0118	0.00861	0.0379	131.987	1.73367622499049	0.885844952252812	1	1.0	0.0	1.0	0.0	0.0	0.0	0.0	0.0	0.0	0.0	0.0	0.0	0.0	0.0	1.0	0.0	Irritante	Timbre Fast_tempo Melody_contourFast_tempo Melody_contour Timbre	Associations_to_a_thought Fast_tempo Music_is_stimulating	0.0	0.0
365	latam	HEX14325	HEX14325-0003	Rumbatá Big Band	not found	Porro Medley	27FQODDsgQRCrhqs3cFZmF	0	                         2004-06-06	0.645	0.608	0.877	5	-8.557	1	0.0534	0.575	0.00639	0.127	93.489	0.329837958665638	0.73365713550723	1	2.0	2.0	0.0	0.0	0.0	0.0	0.0	2.0	0.0	0.0	0.0	0.0	0.0	0.0	0.0	0.0	Reconfortante Alegria	Want_to_dance_or_move Articulation_of_notes Changes_in_sound_level Emotion_is_contagious Fast_tempoChanges_in_sound_level Expectations_or_anticipations Feel_like_singing Keep_beat_with_fingers_or_feet Want_to_dance_or_move Vibrato Timbre Articulation_of_notes	Changes_in_sound_level Expectations_or_anticipations Timbre Want_to_dance_or_move Emotion_is_contagious Lyrics	0.9950248756218907	0.49751243781094534
366	latam	LAX2638	LAX2638-0010	Empezó La Fiesta	not found	Yoko	3uYH4TmzBiDA4PPyVxdNcJ	1	                         2014-06-23	0.679	0.587	0.932	1	-8.615	1	0.043	0.716	0.000513	0.0549	94.349	0.238848441403843	0.966166299979647	1	2.0	2.0	0.0	0.0	0.0	0.0	0.0	2.0	0.0	0.0	0.0	0.0	0.0	0.0	0.0	0.0	Alegre alegría	Articulation_of_notes Associations_to_a_thought Expectations_or_anticipations Visualize_a_mental_image Keep_beat_with_fingers_or_feet Articulation_of_notesFast_tempo Feel_like_singing Feel_pleasure Harmony Want_to_dance_or_move Melody_contour Harmony	Fast_tempo Articulation_of_notes Want_to_dance_or_move Feel_like_singing Feel_pleasure Feel_like_singing Emotion_is_contagious Keep_beat_with_fingers_or_feet	0.49751243781094534	0.0
367	latam	HEX14517	HEX14517-0013	Oscar D'León	not found	Mi Raza Negra	0AtkLMheB17C3CYc1FbzmI	4	                         2006-08-22	0.775	0.887	0.856	7	-3.07	1	0.0572	0.124	0.000105	0.0693	95.026	1.53869868800093	0.644880909072308	1	1.0	1.0	0.0	0.0	0.0	0.0	0.0	0.0	0.0	1.0	0.0	0.0	0.0	0.0	0.0	0.0	Mexida	Fast_tempo Emotion_is_contagious Keep_beat_with_fingers_or_feetEmotion_is_contagious Fast_tempo Harmony Major_mode Expectations_or_anticipations	High_sound_level Music_is_stimulating Fast_tempo Want_to_dance_or_move Feel_pleasure	0.9900990099009901	0.0
368	latam	LAX2638	LAX2638-0004	Fruko Y Sus Tesos	Luis Moyano	Fruko's Boogaloo	4JApaWpUcDWCr8aVfiaaze	16	                         2015-07-01	0.72	0.832	0.836	10	-6.545	0	0.0453	0.126	0.0735	0.291	109.881	1.30039280945813	0.560332121991429	1	1.0	1.0	0.0	0.0	0.0	0.0	0.0	1.0	0.0	0.0	0.0	0.0	0.0	0.0	0.0	0.0	Alegre	High_sound_level Melody_contour VibratoWant_to_dance_or_move Facial_expressions	Melody_contour Want_to_dance_or_move	0.9900990099009901	0.0
369	latam	HEX14325	HEX14325-0004	Rumbatá Big Band	not found	Chivirica	1TeDUg11SAPx0WpETH5cjB	0	                         2004-06-06	0.624	0.83	0.619	7	-7.34	1	0.211	0.789	0.0	0.226	81.102	1.29172714114748	-0.357022217836104	2	0.0	0.0	0.0	0.0	0.0	0.0	0.0	0.0	0.0	0.0	0.0	0.0	0.0	0.0	0.0	0.0				0.0	0.0
370	latam	HEX14517	HEX14517-0016	La tropa	not found	Lluvia Con Nieve	3AqYTORI0rYSqnqBw6gCb5	3	2006	0.718	0.808	0.545	2	-6.168	1	0.162	0.205	0.807	0.093	196.023	1.19640478973036	-0.669852730035355	2	2.0	1.0	1.0	0.0	0.0	0.0	0.0	1.0	0.0	0.0	1.0	0.0	0.0	0.0	0.0	0.0	Stress alegría	Expectations_or_anticipations Want_to_dance_or_move Visualize_a_mental_image Articulation_of_notes Fast_tempo Keep_beat_with_fingers_or_feet Articulation_of_notesHarmony Lyrics Dissonance Minor_mode Melody_contour Harmony Melody_contour	Dissonance Emotion_is_contagious Harmony Articulation_of_notes Fast_tempo Changes_in_sound_level Feel_pleasure Timbre Music_is_stimulating Want_to_dance_or_move	0.9950248756218907	0.49751243781094534
371	latam	LAX2638	LAX2638-0015	Wayne Gorbea	not found	Dejame Un Lado	7y5rT2UOAKT42FU1HxVmOi	7	                         2007-10-08	0.615	0.684	0.593	0	-7.263	0	0.0377	0.73	0.0001	0.287	104.252	0.659133354470235	-0.466935641041246	2	1.0	1.0	0.0	0.0	0.0	0.0	0.0	1.0	0.0	0.0	0.0	0.0	0.0	0.0	0.0	0.0	ballable	Fast_tempo Harmony TimbreArticulation_of_notes Keep_beat_with_fingers_or_feet	Want_to_dance_or_move Music_is_stimulating	0.9900990099009901	0.0
372	latam	JK190257	JK190257-0001	Marco Barrientos	not found	Nada Es Imposible	6RTf7gp7JzsZcplNzx3KTa	14	                         2014-01-01	0.698	0.858	0.485	10	-6.46	1	0.0411	0.164	0.0	0.0916	140.943	1.41304649749655	-0.923499091277991	2	2.0	2.0	0.0	0.0	0.0	0.0	0.0	2.0	0.0	0.0	0.0	0.0	0.0	0.0	0.0	0.0	Pirosinha (cutre) ánimo	Articulation_of_notes Fast_tempo High_sound_level Keep_beat_with_fingers_or_feet Melody_contourMajor_mode Articulation_of_notes Note_durations Harmony Lyrics	Harmony Conditioned High_sound_level Major_mode Feel_like_singing Emotion_is_contagious	0.49751243781094534	0.0
373	latam	KHX2782	KHX2782-0007	Chango Farias Gomez	not found	Rumbas	6Y5b99tznlVmW8P2gsJ12r	4	                         2003-07-22	0.569	0.782	0.634	9	-10.702	0	0.0734	0.182	0.00533	0.648	115.05	1.08375110169195	-0.293610627525445	2	2.0	2.0	0.0	0.0	0.0	0.0	0.0	0.0	0.0	2.0	0.0	0.0	0.0	0.0	0.0	0.0	Rica energía	Fast_tempo Harmony High_sound_level Note_durationsHarmony Facial_expressions Emotion_is_contagious Melody_contour	Timbre Fast_tempo Harmony Keep_beat_with_fingers_or_feet	0.9950248756218907	0.0
374	latam	KHX1585	KHX1585-0017	Suni Paz	not found	La pájara pinta (The Spotted Bird)	4iEBAbgNDDeAX4hrU2HdhS	0	                         2002-08-13	0.743	0.295	0.488	3	-11.771	1	0.127	0.895	0.0	0.114	109.076	-1.02633913195066	-0.910816773215859	3	1.0	0.0	0.0	0.0	1.0	1.0	0.0	0.0	0.0	0.0	0.0	0.0	0.0	0.0	0.0	0.0	tierna	Slow_tempoConsonance	Want_to_dance_or_move	0.9900990099009901	0.0
375	latam	HEX9803	HEX9803-0014	Soledad Bravo	not found	Si el poeta eres tú	08oSf3enmWZfZVQMSSUw1I	13	1997	0.525	0.131	0.301	7	-14.185	1	0.0381	0.972	2.82e-05	0.108	132.358	-1.73692393342373	-1.70134793242207	3	1.0	0.0	0.0	0.0	1.0	0.0	0.0	0.0	1.0	0.0	0.0	0.0	0.0	0.0	0.0	0.0	Esperanza	Feel_like_singingLyrics	Harmony	0.9900990099009901	0.0
376	latam	HEX15069	HEX15069-0004	Mercedes Sosa	not found	Tú Que Puedes, Vuélvete	285yiYuIEXJcyOu8y6cdOi	18	                         2010-01-01	0.589	0.0673	0.191	9	-12.618	0	0.0541	0.946	0.000689	0.133	137.65	-2.01292546911785	-2.16636626136691	3	1.0	0.0	0.0	1.0	0.0	0.0	1.0	0.0	0.0	0.0	0.0	0.0	0.0	0.0	0.0	0.0	Lágrimas	Associations_to_a_thoughtLyrics	Emotion_is_contagious	0.9900990099009901	0.9900990099009901
377	latam	HEX9803	HEX9803-0004	Atahualpa Yupanqui	not found	Nada Mas	55lPuFM7ChWhaHlFRVdZWn	21	                         2004-09-28	0.57	0.0965	0.647	7	-15.197	0	0.0709	0.953	0.211	0.108	134.833	-1.8864067117824	-0.238653915922874	3	2.0	0.0	0.0	2.0	0.0	0.0	1.0	0.0	0.0	0.0	0.0	0.0	0.0	1.0	0.0	0.0	Pesada Enyorança	Articulation_of_notes Emotion_is_contagious Feel_like_singing Low_sound_level Tempo_variability Articulation_of_notesMinor_mode Melody_contour Conditioned Visualize_a_mental_image Low_sound_level Harmony	Articulation_of_notes Melody_contour Visualize_a_mental_image Timbre Lyrics	0.49751243781094534	0.0
378	latam	HEX9834	HEX9834-0011	Caterina Valente / Silvio Francesco	not found	Quiereme Mucho	1ywzbnvHdHJxzCVe38zdT0	0	1957	0.616	0.142	0.376	9	-15.393	0	0.0395	0.957	1.37e-05	0.294	132.554	-1.68926275771517	-1.38428998086878	3	1.0	0.0	0.0	1.0	0.0	0.0	1.0	0.0	0.0	0.0	0.0	0.0	0.0	0.0	0.0	0.0	melancolía	Slow_tempo HarmonyMelody_contour Minor_mode	Visualize_a_mental_image	0.0	0.0
379	latam	KHX1585	KHX1585-0018	Luis Méndez	Guadalupe Bracamonte	Corrido de Joaquín Murrieta	0lkt2We1EQra93oWiWlwpW	0	                         2002-08-13	0.628	0.172	0.735	4	-11.916	1	0.0483	0.99	5.44e-05	0.119	110.757	-1.55927773305546	0.133360747232992	4	0.0	0.0	0.0	0.0	0.0	0.0	0.0	0.0	0.0	0.0	0.0	0.0	0.0	0.0	0.0	0.0				0.0	0.0
380	latam	HEX9435	HEX9435-0006	De Norte A Sur	not found	El gavilan (Venezuela)	15VJ4TNlnzk8RMSRl64WTt	0	                         2013-10-29	0.675	0.397	0.767	11	-14.927	0	0.0454	0.717	0.0	0.089	109.85	-0.584390048107647	0.268638806562398	4	9.0	7.0	1.0	1.0	0.0	0.0	1.0	7.0	0.0	0.0	1.0	0.0	0.0	0.0	0.0	0.0	cumba Alegría	Emotion_is_contagious Fast_tempo Emotion_is_contagious Melody_contour Lyrics Fast_tempo Consonance Articulation_of_notes Keep_beat_with_fingers_or_feet Lyrics Melody_contourWant_to_dance_or_move Conditioned Feel_like_singing Lyrics Lyrics Harmony Fast_tempo Harmony Lyrics Keep_beat_with_fingers_or_feet Emotion_is_contagious	Emotion_is_contagious Emotion_is_contagious por que no entiendo las demás Articulation_of_notes Lyrics Feel_like_singing Feel_pleasure Feel_like_singing Lyrics Want_to_dance_or_move	0.4439511653718091	0.0
381	latam	HEX7424	HEX7424-0009	Guillermo Portabales	Trio Matamoros	Se contento el jibarito	4O2LZzOjxDem3j71yhin48	2	                         2010-08-04	0.685	0.487	0.965	2	-7.339	1	0.111	0.964	3.56e-05	0.115	85.278	-0.19443497412852	1.1056717986631	4	2.0	1.0	0.0	0.0	1.0	0.0	0.0	0.0	0.0	0.0	0.0	0.0	1.0	0.0	0.0	1.0	Serena intriga	Conditioned Lyrics Want_to_dance_or_moveHarmony Melody_contour Major_mode Lyrics Want_to_dance_or_move	Associations_to_a_thought Facial_expressions Feel_like_singing Lyrics Emotion_is_contagious Fast_tempo	0.49751243781094534	0.0
382	latam	KLX0545	KLX0545-0020	Charivari Trio	not found	Milonga sentimental	2MARRf5B7sJd8hmZsjin37	0	                         2006-12-05	0.615	0.436	0.888	9	-10.89	1	0.0554	0.748	0.0193	0.282	117.747	-0.415409516050026	0.780158968401714	4	2.0	2.0	0.0	0.0	0.0	0.0	0.0	0.0	0.0	2.0	0.0	0.0	0.0	0.0	0.0	0.0	Dramática Sosiego	Fast_tempo Want_to_dance_or_move Emotion_is_contagious Goosebumps_or_chills Timbre Vibrato Melody_contour Fast_tempoHarmony Emotion_is_contagious Expectations_or_anticipations Facial_expressions Timbre Lyrics	Emotion_is_contagious Facial_expressions Harmony Note_durations Fast_tempo Timbre Feel_pleasure Harmony	0.49751243781094534	0.0
383	latam	HEX15069	HEX15069-0003	Mercedes Sosa	not found	Chacarera De Las Piedras	4CgzVGlcm6UFMkmqCpOAZe	20	                         2010-01-01	0.745	0.364	0.759	5	-10.519	0	0.119	0.785	0.000456	0.106	79.728	-0.727373575233327	0.234819291730046	4	1.0	0.0	0.0	0.0	1.0	1.0	0.0	0.0	0.0	0.0	0.0	0.0	0.0	0.0	0.0	0.0	Respeito	Articulation_of_notes Associations_to_a_thought TimbreLyrics Expectations_or_anticipations Visualize_a_mental_image Timbre Facial_expressions	Emotion_is_contagious Expectations_or_anticipations Facial_expressions	0.9900990099009901	0.0
384	latam	HEX1468	HEX1468-0008	Jorge Negrete	not found	Allá en el rancho grande (remastered)	3a9QpnHcG3KeLgv7Lhc6yy	44	                         2002-01-01	0.392	0.655	0.92	9	-5.634	1	0.0385	0.448	0.00485	0.071	140.098	0.830479542279649	1.10450624124838	1	0.0	0.0	0.0	0.0	0.0	0.0	0.0	0.0	0.0	0.0	0.0	0.0	0.0	0.0	0.0	0.0				0.0	0.0
385	latam	HEX15221	HEX15221-0017	Juan Gabriel	not found	Buenos Días Señor Sol	4AMwNq3toJIDjeCLhnK8DL	52	2011	0.332	0.723	0.949	2	-8.681	1	0.0337	0.228	0.0	0.207	159.627	1.12550189994194	1.21767541499585	1	1.0	1.0	0.0	0.0	0.0	0.0	0.0	1.0	0.0	0.0	0.0	0.0	0.0	0.0	0.0	0.0	animada	Fast_tempo Melody_contourConsonance Harmony	Feel_like_singing	0.9900990099009901	0.0
386	latam	HEX5940	HEX5940-0013	Renacimiento 74	not found	Panuelo Blanco - En Vivo	2VgRTLpMVpyMrwEPiE8SqY	0	                         2018-05-26	0.376	0.854	0.854	2	-5.451	1	0.172	0.238	0.0	0.942	204.063	1.69385379485018	0.846948811340349	1	0.0	0.0	0.0	0.0	0.0	0.0	0.0	0.0	0.0	0.0	0.0	0.0	0.0	0.0	0.0	0.0				0.0	0.0
387	latam	HEX7361	HEX7361-0002	Chalino Sanchez	Los Titanes De Sinaloa	El Cabo Sauceda	4x5WVFVgvzIcvvQiqH6Aw1	10	2003	0.349	0.647	0.819	2	-5.533	1	0.0518	0.865	0.000904	0.31	195.181	0.795771029613497	0.710365325783057	1	1.0	1.0	0.0	0.0	0.0	0.0	0.0	1.0	0.0	0.0	0.0	0.0	0.0	0.0	0.0	0.0	Animada	High_sound_level Articulation_of_notesNote_durations Timbre	Timbre Feel_pleasure	0.9900990099009901	0.0
388	latam	KHX0656	KHX0656-0003	Graciana Silva Garcia	not found	El Siquisiri	3tVshAdoRwd9zBTq0c3smO	0	2005	0.491	0.726	0.807	0	-10.11	1	0.0694	0.647	0.00357	0.538	107.559	1.13851759219175	0.663536702163414	1	0.0	0.0	0.0	0.0	0.0	0.0	0.0	0.0	0.0	0.0	0.0	0.0	0.0	0.0	0.0	0.0				0.0	0.0
389	latam	HEX9641	HEX9641-0004	Chingon	not found	Severina	0x3wIfj2dJL4DxF9sffZRi	23	                         2010-08-31	0.206	0.778	0.501	8	-4.042	1	0.0506	0.146	0.0	0.274	160.612	1.36412292452174	-0.530593200137477	2	0.0	0.0	0.0	0.0	0.0	0.0	0.0	0.0	0.0	0.0	0.0	0.0	0.0	0.0	0.0	0.0				0.0	0.0
390	latam	JK103835	JK103835-0006	Molotov	not found	Ñero	4Xbg3XroIxGyp4Eu9xscFn	31	                         1999-01-01	0.412	0.926	0.407	9	-4.182	1	0.134	0.000643	0.000334	0.103	189.998	2.00623040884555	-0.897417418491346	2	0.0	0.0	0.0	0.0	0.0	0.0	0.0	0.0	0.0	0.0	0.0	0.0	0.0	0.0	0.0	0.0				0.0	0.0
391	latam	JK136421	JK136421-0011	Jaguares	not found	La Llorona	7xbpe3whNetb9nv4zJ7S4x	32	                         2002-10-22	0.294	0.584	0.214	2	-7.425	0	0.0348	0.0242	0.0148	0.113	170.298	0.52244149236755	-1.65057778170727	2	0.0	0.0	0.0	0.0	0.0	0.0	0.0	0.0	0.0	0.0	0.0	0.0	0.0	0.0	0.0	0.0				0.0	0.0
392	latam	JK147861	JK147861-0005	Café Tacvba	not found	Volver A Comenzar	70LC9mcVfFoITE6PAG5s87	51	                         2007-01-01	0.39	0.628	0.434	1	-6.274	0	0.0297	0.00235	0.00109	0.137	130.023	0.713338312031386	-0.792053015347149	2	0.0	0.0	0.0	0.0	0.0	0.0	0.0	0.0	0.0	0.0	0.0	0.0	0.0	0.0	0.0	0.0				0.0	0.0
393	latam	JK237440	JK237440-0009	Zoé	not found	Renacer	2Wt26eFSwT5bSZV6QmtmEB	46	                         2018-04-18	0.237	0.623	0.0485	2	-8.299	1	0.0416	0.217	0.853	0.0837	169.856	0.691645491615041	-2.29642254912817	2	2.0	0.0	0.0	2.0	0.0	0.0	2.0	0.0	0.0	0.0	0.0	0.0	0.0	0.0	0.0	0.0	calmada Melancólica	Slow_tempo Associations_to_a_thoughtLow_sound_level Lyrics	Harmony Memories_of_somebody/something	0.0	0.0
394	latam	HEX11242	HEX11242-0010	Agustin Lara	Rolando Villazón	Noche de Ronda	53J6uLgbYXR13stcZGae8d	3	                         2010-01-01	0.242	0.254	0.164	4	-15.139	0	0.0419	0.912	0.00694	0.356	79.248	-0.909284655111217	-1.84569704678911	3	0.0	0.0	0.0	0.0	0.0	0.0	0.0	0.0	0.0	0.0	0.0	0.0	0.0	0.0	0.0	0.0				0.0	0.0
395	latam	HEX4394	HEX4394-0005	Mili Bermejo	not found	Muerte de Atahualpa (Death of Atahualpa)	0MKIqxYl2dWOzoZ1CVmewF	0	                         2006-04-17	0.348	0.12	0.142	1	-19.086	1	0.0336	0.662	0.000243	0.671	88.949	-1.49065224226926	-1.93154952342512	3	1.0	0.0	0.0	1.0	0.0	0.0	1.0	0.0	0.0	0.0	0.0	0.0	0.0	0.0	0.0	0.0	tristesa	Low_sound_level Slow_tempoEmotion_is_contagious Music_is_stimulating	Lyrics Melody_contour	0.0	0.0
396	latam	KHX0204	KHX0204-0009	Trio Mexico	not found	Peregrina	3V6nRj2GFM43yurHTrLU77	2	                         2008-10-24	0.358	0.286	0.272	3	-11.288	0	0.0423	0.903	0.00108	0.296	78.629	-0.770450604446609	-1.42423943421233	3	1.0	0.0	0.0	1.0	0.0	0.0	1.0	0.0	0.0	0.0	0.0	0.0	0.0	0.0	0.0	0.0	aburrida	Slow_tempoSlow_tempo	Slow_tempo Articulation_of_notes	0.0	0.0
397	latam	KHX1799	KHX1799-0003	Pedro Infante	not found	Fallaste Corazon	1AVYuYRuIf0AHNvk5Ltnrw	0	                         2014-01-15	0.357	0.237	0.489	7	-9.671	1	0.0367	0.848	0.000504	0.184	84.917	-0.98304024452679	-0.57742182375712	3	2.0	0.0	1.0	0.0	1.0	1.0	0.0	0.0	0.0	0.0	0.0	1.0	0.0	0.0	0.0	0.0	Desamor nostalgia	Slow_tempo Changes_in_sound_levelMelody_contour Consonance	Lyrics Feel_pleasure	0.9950248756218907	0.49751243781094534
398	latam	KHX1465	KHX1465-0003	Aida Cuevas	"Alberto Angel ""El Cuervo"""	Rogaciano el Huapamguero	3CadSOCWgignPwIUFT3sMD	15	                         2014-01-15	0.483	0.278	0.452	9	-11.429	0	0.0365	0.48	0.000148	0.253	125.593	-0.805159117112761	-0.721810079917685	3	1.0	0.0	1.0	0.0	0.0	0.0	0.0	0.0	0.0	0.0	1.0	0.0	0.0	0.0	0.0	0.0	venjança	Articulation_of_notes TimbreMelody_contour Lyrics Minor_mode	Music_is_stimulating Lyrics	0.9900990099009901	0.0
399	latam	JHX4077	JHX4077-0008	Lydia Mendoza	not found	Te Dedico Esta Cancion	2pZvjvHd1AeOrp6ovd2VwF	0	2006	0.488	0.308	0.774	9	-10.96	1	0.31	0.871	0.0138	0.143	168.859	-0.675002194614692	0.534757987209397	4	1.0	0.0	0.0	1.0	0.0	0.0	1.0	0.0	0.0	0.0	0.0	0.0	0.0	0.0	0.0	0.0	pena	Low_sound_level Slow_tempoMelody_contour Note_durations	Associations_to_a_thought	0.0	0.0
400	latam	KHX0346	KHX0346-0011	Trío Los Camperos Huastecos	not found	El Apasionado	3IgsKmEmsJaVU6CRi6wLSy	3	1985	0.492	0.322	0.847	0	-15.739	1	0.0493	0.709	1.18e-05	0.359	160.733	-0.614262297448926	0.81963211422889	4	0.0	0.0	0.0	0.0	0.0	0.0	0.0	0.0	0.0	0.0	0.0	0.0	0.0	0.0	0.0	0.0				0.0	0.0
401	latam	KHX0616	KHX0616-0018	Los Hermanos Pérez Maya	not found	El Llorar	61dMQIYTwZbX7sSxzyzd22	2	1996	0.497	0.219	0.783	6	-12.27	1	0.0583	0.817	5.67e-05	0.297	98.369	-1.06113439802563	0.569879454924128	4	0.0	0.0	0.0	0.0	0.0	0.0	0.0	0.0	0.0	0.0	0.0	0.0	0.0	0.0	0.0	0.0				0.0	0.0
402	latam	KHX1661	KHX1661-0004	Los Campesinos De Michoacan	not found	Una Plegaria A Mi Madre	1LbVDBqUgsnT6gER4iyULc	0	2003	0.41	0.326	0.859	8	-7.725	1	0.0343	0.664	2.17e-05	0.327	179.403	-0.59690804111585	0.866460737848533	4	1.0	1.0	0.0	0.0	0.0	0.0	0.0	1.0	0.0	0.0	0.0	0.0	0.0	0.0	0.0	0.0	Júbilo	Note_durationsMelody_contour	High_sound_level	0.9900990099009901	0.0
403	latam	KHX2702	KHX2702-0016	Camperos de Valles	not found	La Leva	0ufa4jau8pqg6cRfEKK4Rt	0	                         2012-03-16	0.48	0.321	0.953	6	-16.331	1	0.0607	0.778	0.0239	0.109	153.719	-0.618600861532195	1.2332849562024	4	1.0	1.0	0.0	0.0	0.0	0.0	0.0	1.0	0.0	0.0	0.0	0.0	0.0	0.0	0.0	0.0	Alegria	Fast_tempoConsonance	Melody_contour	0.0	0.0
404	latam	HDX4887	HDX4887-0003	José Feliciano	not found	Bamboleo	7iwabKnxFXSuGCdmNZ1UDk	16	                         2004-01-01	0.621	0.83	0.852	6	-10.133	0	0.0394	0.468	0.00214	0.121	122.533	0.992471119002471	0.555286477582992	1	1.0	1.0	0.0	0.0	0.0	0.0	0.0	1.0	0.0	0.0	0.0	0.0	0.0	0.0	0.0	0.0	animada	Articulation_of_notes Fast_tempoWant_to_dance_or_move Melody_contour	Emotion_is_contagious Timbre	0.9900990099009901	0.9900990099009901
405	latam	HEX0203	HEX0203-0007	Richie Ricardo	not found	Casimiro	510iVXLU5kpwPmiyYRmPKF	3	                         1980-05-21	0.795	0.954	0.961	4	-2.424	0	0.0584	0.402	1.92e-05	0.182	138.892	1.62652465121102	1.07551175245197	1	0.0	0.0	0.0	0.0	0.0	0.0	0.0	0.0	0.0	0.0	0.0	0.0	0.0	0.0	0.0	0.0				0.0	0.0
406	latam	HEX11978	HEX11978-0024	Juanchín y sus Pleneros del Palmar	Tasso Peña	Maldito Vicio	4Xx9G7RA6L2Sbq7qnlprJx	2	                         2012-07-09	0.57	0.875	0.965	5	-5.252	0	0.0543	0.67	0.118	0.356	124.235	1.22257119117493	1.09460258822697	1	0.0	0.0	0.0	0.0	0.0	0.0	0.0	0.0	0.0	0.0	0.0	0.0	0.0	0.0	0.0	0.0				0.0	0.0
407	latam	HEX2329	HEX2329-0001	El Gran Combo De Puerto Rico	Andy Montañez	Mi China Me Boto	04AjENPUM9m4Xa6pVMTEcW	2	                         1970-02-09	0.758	0.773	0.965	10	-4.33	1	0.0345	0.692	0.00751	0.45	109.819	0.701011027584024	1.09460258822697	1	0.0	0.0	0.0	0.0	0.0	0.0	0.0	0.0	0.0	0.0	0.0	0.0	0.0	0.0	0.0	0.0				0.0	0.0
