	selection	cdr_title_num	cdr_track_num	composer_name	artist_name	track_name	track_id	popularity	year_rec	danceability	energy	valence	key	loudness	mode	speechiness	acousticness	instrumentalness	liveness	tempo	norm_energy	norm_valence	quadrant	num_users	1	2	3	4	tenderness	sadness	joy	transcendence	power	tension	fear	peace	bitterness	anger	surprise	txt_free	txt_quad	txt_mood	pref	fam
779	choir	DFX0509	DFX0509-0002	Paul Hindemith	Robin Gritton	Eine lichte Mitternacht	0jicUl62JnKRdcDFK3zgdE	0	2000	0.0758	0.0254	0.0376	9	-30.63	1	0.0419	0.962	0.0363	0.106	176.855	-0.715694861035861	-0.620545520022882	3	24.0	0.0	3.0	18.0	3.0	0.0	12.0	0.0	1.0	0.0	0.0	2.0	2.0	6.0	1.0	0.0	francia negative	High energy song due to the male voices predominancy  it doesnt have much rythm slow tempo Melody_contour Low_sound_level Low_sound_level Dissonance Slow_tempo Conditioned DissonanceThe emotion of fear  slow tempo and alteration The notes large timing variations Melody_contour Minor_mode Harmony Dissonance Minor_mode Timbre Articulation_of_notes	Emotion transmitted The chords It is the feeling that describes better how I have felt Articulation_of_notes Low_sound_level Harmony Minor_mode Dissonance Expectations_or_anticipations Slow_tempo	0.08329862557267805	0.5414410662224073
780	choir	DFX0664	DFX0664-0006	Robert Schumann	Kirsten Drope	Romanzen und Balladen, Book 2, Op. 75: Schnitter Tod	4jMvWZuWbcEgDqUAPKwxQ7	0	                         2000-01-01	0.267	0.0465	0.118	5	-23.746	1	0.0427	0.987	0.0	0.109	130.985	-0.50320819283341	-0.154072573942469	3	27.0	3.0	5.0	8.0	11.0	0.0	6.0	0.0	6.0	2.0	2.0	2.0	5.0	2.0	1.0	1.0	religiosa miedo nostalgia inspiradora asombro	Low energy for the mix of voices  It has legatto slow tempo Articulation_of_notes Changes_in_sound_level Low_sound_level Low_sound_level Slow_tempo Major_mode Articulation_of_notes Melody_contour Low_sound_level Consonance Changes_in_sound_level Visualize_a_mental_image Left_me_in_aweSadness and tension transmitted For me this song is in the middle Difficult to choose  it oscillates i do not feel comfortable while listening the song Changes_in_sound_level Expectations_or_anticipations Harmony Harmony Consonance Slow_tempo Note_durations Emotion_is_contagious Harmony Timbre Goosebumps_or_chills Memories_of_somebody/something Slow_tempo	Emotion transmitted Is the one that fits best i do not feel comfortable while listening the song Lyrics Expectations_or_anticipations Harmony Consonance Harmony Melody_contour Note_durations Conditioned Timbre Emotion_is_contagious Associations_to_a_thought High_sound_level Visualize_a_mental_image	0.259163272861903	0.5553498704183636
781	choir	DFX0958	DFX0958-0006	Frank Schwemmer	Athesinus Consort Berlin	4 Lieder von Licht und Schatten: No. 2, Es geht ein dunkle Wolk herein	66aTeMNAypaFhcAx9NEPRJ	0	                         2014-09-02	0.262	0.0475	0.0337	11	-29.264	0	0.0405	0.988	0.0545	0.126	90.95	-0.493137734624763	-0.64317293904917	3	21.0	1.0	1.0	18.0	1.0	1.0	15.0	1.0	0.0	0.0	0.0	0.0	0.0	3.0	1.0	0.0		Mainly high energy song  There is a small variation in the notes and rythms slow tempo Harmony Low_sound_level Slow_tempo Note_durationsThe emotion of sadness with a slow tempo and no changing The notes are sad large timing variations Melody_contour Harmony Dissonance Minor_mode	Closer to emotion conveyed For the notes Makes me feel sad Articulation_of_notes Harmony Goosebumps_or_chills Dissonance	0.23798191337458352	0.5711565920990004
782	choir	DFX0343	DFX0343-0006	Franz Schubert	Arnold Schoenberg Chor	"Schubert : Cantata - 'zu Ehren von Joseph Spendou' D472 : III ""Ein Punkt nur ist der Mensch"""	77uJ4jU8UDiHXUaA5H9xWj	0	1997	0.379	0.0437	0.187	2	-17.886	1	0.0428	0.984	0.000106	0.116	148.649	-0.531405475817621	0.246258685753407	4	26.0	2.0	4.0	4.0	16.0	5.0	1.0	0.0	7.0	2.0	1.0	1.0	4.0	3.0	2.0	0.0	iglesia transcendente pau Confusión	"High energy song due to the instruments and voices At first  I thought it was low energy only when listening to the music part at the beginning  but after then I thought it was high-energy because there were parts that the man said aloud and the rising melodies.
 Due to the chords fast tempo Low_sound_level Melody_contour Low_sound_level Slow_tempo Harmony Note_durations Low_sound_level Melody_contour Left_me_in_awe Low_sound_levelThe emotion of power  The man's words may be positive because I don't know German well  but if someone spoke to me like that  I would feel as if he was angry with me. Also background music is kind of depressive.
 It sounds like the soloist is telling a story that is not sad fast and irregular vibrato Associations_to_a_thought Goosebumps_or_chills Consonance Articulation_of_notes Harmony Slow_tempo Consonance Harmony Slow_tempo Low_sound_level Visualize_a_mental_image"	Emotion conveyed I chose anger because he sings in an angry way. I didn't choose fear and tension because background music didn't make me feel afraid or tense. Makes me feel tense Emotion_is_contagious Visualize_a_mental_image Consonance Articulation_of_notes Melody_contour Timbre Consonance Emotion_is_contagious Visualize_a_mental_image Expectations_or_anticipations Emotion_is_contagious	0.2691272587466359	0.5382545174932718
783	choir	DFX0334	DFX0334-0065	Johannes Brahms	MDR Leipzig Radio Chorus	12 Deutsche Volkslieder, WoO 35: No. 3. Erlaube mir	00x7MDvBxvebcAIyKrJy4L	0	                         2016-07-01	0.246	0.0465	0.155	5	-30.218	1	0.0361	0.993	4.85e-05	0.196	80.107	-0.50320819283341	0.060597811691551	4	27.0	5.0	0.0	7.0	15.0	5.0	4.0	5.0	0.0	0.0	0.0	0.0	10.0	3.0	0.0	0.0	espiritual profunda soletat Calma	Mix of voices  It doesnt have a big presence Slow mean tempo Consonance Articulation_of_notes Keep_beat_with_fingers_or_feet Minor_mode Low_sound_level Slow_tempo Articulation_of_notes Low_sound_level Note_durations Note_durations Melody_contourEmotion oh hope and positiveness For the notes slow vibrato Harmony Major_mode High_sound_level Emotion_is_contagious Harmony Consonance Harmony Harmony Melody_contour Conditioned Low_sound_level	Emotion conveyed It is like a sleeping song Makes me feel sad Slow_tempo Emotion_is_contagious Melody_contour Harmony Consonance Major_mode Consonance Melody_contour Slow_tempo Memories_of_somebody/something	0.22213994816734542	0.5923731951129211
784	choir	DFX0727	DFX0727-0024	Karlheinz Stockhausen	Paul Hillier	Stimmung: Stimmung: Model 24	4KuV3snd78C4143lQzbOJm	4	                         2007-09-11	0.297	0.0302	0.264	10	-29.835	0	0.0578	0.984	0.941	0.168	55.585	-0.667356661634356	0.693005163964747	4	26.0	4.0	10.0	10.0	2.0	0.0	6.0	0.0	2.0	0.0	9.0	1.0	0.0	4.0	0.0	4.0	ritual tensa nostalgia confusión	For the mix of voices   small tempo variability  small timing variations For me this song is like spiritual and therefor it doesnt have a high energy Fast tempo El ritme de les notes són importants Note_durations Harmony Articulation_of_notes Fast_tempo Associations_to_a_thought Conditioned Changes_in_sound_level Conditioned Changes_in_sound_level Tempo_variability Associations_to_a_thoughtEmotion of fear due to the changing fast mean tempo It doesnt express negative emotions at all large timing variation Dissonance Changes_in_sound_level Consonance Major_mode Harmony Expectations_or_anticipations Melody_contour Dissonance Changes_in_sound_level Conditioned Slow_tempo	Emotion transmitted  the repeated parts gave me a feeling of tension. Music doesn't resolve and male arpeggio is combined with repeated female voices in the background with creates confusion For the spirituallity It is the feeling that describes better how I have felt Dissonance Consonance Articulation_of_notes Goosebumps_or_chills Harmony Goosebumps_or_chills Articulation_of_notes Low_sound_level Left_me_in_awe Memories_of_somebody/something Changes_in_sound_level	0.11534025374855823	0.5382545174932718
785	choir	DFX0783	DFX0783-0047	Johannes Brahms	Cologne West German Radio Chorus	15 Neue Liebeslieder Waltzes, Op. 65: No. 13. Nein, Geliebter	0qySD7NRfvs8mhrNH5CaID	0	                         2013-08-01	0.282	0.0291	0.287	4	-30.681	1	0.0375	0.995	0.909	0.157	123.579	-0.678434165663867	0.826448917196705	4	26.0	9.0	1.0	0.0	16.0	4.0	0.0	9.0	2.0	0.0	0.0	0.0	10.0	0.0	1.0	0.0	navideña fervor Paz	Introduction of instruments  For the little presence Sharp attacks sometimes  piano small tempo variability Perquè la música és tranquil·la però no és lenta  va caminant Note_durations Articulation_of_notes Note_durations Fast_tempo Keep_beat_with_fingers_or_feet Harmony Low_sound_level Major_mode Articulation_of_notes Harmony Low_sound_level Melody_contourPositive emotion due to fast tempo and alterations For teh notes Major scale high sound level Dóna alegria  ganes de dansar Consonance Melody_contour Harmony Harmony Consonance Consonance Major_mode Associations_to_a_thought Harmony Emotion_is_contagious	Emotion conveyed Makes me feel happy És tranquil·la i alegre Visualize_a_mental_image Want_to_dance_or_move Harmony Harmony Major_mode Articulation_of_notes Memories_of_somebody/something Left_me_in_awe Visualize_a_mental_image	0.19223375624759706	0.5382545174932718
786	choir	DFX1108	DFX1108-0007	Johannes Brahms	Rundfunkchor Berlin	Warum ist das Licht gegeben den Mühseligen, Op. 74 No. 1: IV. Mit Fried und Freud	6tUDAhxHNwTdr2k2mQ1u8J	4	                         2019-05-03	0.16	0.046	0.191	0	-31.316	1	0.0398	0.989	0.000285	0.0979	102.813	-0.508243421937733	0.269466295011139	4	23.0	0.0	0.0	10.0	13.0	1.0	8.0	0.0	4.0	0.0	0.0	0.0	8.0	2.0	0.0	0.0	tristeza	Mix of voices with low energy  It creates a smooth low energy environment slow tempo Tot i que el principi es canta més fort  en general el tempo és flexible  melòdic i expressiu (el ritme no és accelerat) Slow_tempo Harmony Low_sound_level Harmony Articulation_of_notes Minor_modeSadness transmitted  low tempo  I feel peace and serenity makes me feel sad És contemplatiu però amb certa pau  certa felicitat. Melody_contour Consonance Harmony Slow_tempo Articulation_of_notes Slow_tempo	Emotion transmitted For the smoothness of the song Makes me feel sad Per mi és una música amb pau però té un esperit molt transcendental Emotion_is_contagious Consonance Harmony Consonance Major_mode Articulation_of_notes	0.2607561929595828	0.651890482398957
787	africa	JKX4050	JKX4050-0006	Mory Kanté	not found	Dia	4r1PQ8mMBuN6QzlLGeZhMS	12	                         1987-01-01	0.695	0.803	0.849	8	-13.823	1	0.039	0.198	0.356	0.0524	124.83	1.31333236223361	0.920554309026986	1	2.0	2.0	0.0	0.0	0.0	0.0	0.0	2.0	0.0	0.0	0.0	0.0	0.0	0.0	0.0	0.0		Fast_tempo Fast_tempo Keep_beat_with_fingers_or_feetFast_tempo Harmony Articulation_of_notes	Fast_tempo Emotion_is_contagious Feel_like_singing	0.9950248756218907	0.49751243781094534
788	africa	JK84703	JK84703-0006	Mory Kanté	not found	Kounmakan	0SPRweywD03wII0wKrbM4H	1	1996	0.76	0.846	0.8	5	-6.399	0	0.0679	0.212	0.00516	0.132	94.171	1.50138707891841	0.688079957151481	1	2.0	2.0	0.0	0.0	0.0	0.0	0.0	2.0	0.0	0.0	0.0	0.0	0.0	0.0	0.0	0.0		Consonance Keep_beat_with_fingers_or_feetConsonance Harmony Melody_contour	Consonance Emotion_is_contagious Feel_like_singing	0.9950248756218907	0.49751243781094534
789	africa	KEX1214	KEX1214-0007	Kassé-Mady Diabaté	not found	Maliba	2yzOg9sCtxETzZdjEdwwyX	0	2009	0.663	0.848	0.827	7	-5.52	1	0.0393	0.00664	0.0679	0.417	107.081	1.510133809927	0.816178069409412	1	2.0	2.0	0.0	0.0	0.0	0.0	0.0	2.0	0.0	0.0	0.0	0.0	0.0	0.0	0.0	0.0		Articulation_of_notes Melody_contour ConsonanceArticulation_of_notes Harmony	Articulation_of_notes Emotion_is_contagious Feel_like_singing	0.49751243781094534	0.49751243781094534
790	africa	JK116914	JK116914-0009	King Kora	not found	Nialing Koli	1TwvdP2fQKOJr6fejMdu8T	0	                         2002-01-01	0.58	0.857	0.96	10	-6.566	0	0.0467	0.0492	0.278	0.094	66.741	1.54949409946568	1.44717988164293	1	2.0	2.0	0.0	0.0	0.0	0.0	0.0	2.0	0.0	0.0	0.0	0.0	0.0	0.0	0.0	0.0		Keep_beat_with_fingers_or_feet Articulation_of_notes Fast_tempoKeep_beat_with_fingers_or_feet Harmony Melody_contour	Keep_beat_with_fingers_or_feet Emotion_is_contagious	0.9950248756218907	0.0
791	africa	HEX14681	HEX14681-0009	Harouna Samake	not found	Lanaya Fouru	2ZXvgMJEQvayhSEgeZd7ss	1	                         2018-08-16	0.697	0.87	0.893	3	-5.818	0	0.0363	0.758	0.000131	0.141	112.009	1.60634785102155	1.12930678826213	1	1.0	1.0	0.0	0.0	0.0	0.0	0.0	1.0	0.0	0.0	0.0	0.0	0.0	0.0	0.0	0.0		Fast_tempo Keep_beat_with_fingers_or_feetHarmony Melody_contour	Emotion_is_contagious Articulation_of_notes	0.9900990099009901	0.0
792	africa	KEX1301	KEX1301-0005	Samba Touré	not found	Moussoya feat. Oumou Sangaré	7LYEI4BLwHYht1nFWG1Tht	3	                         2011-08-30	0.711	0.574	0.903	11	-9.631	1	0.0433	0.533	0.0312	0.0964	100.025	0.311831661749454	1.17675053354285	1	0.0	0.0	0.0	0.0	0.0	0.0	0.0	0.0	0.0	0.0	0.0	0.0	0.0	0.0	0.0	0.0				0.0	0.0
793	africa	KEX0676	KEX0676-0002	Ballaké Sissoko	Mama Draba	Detigiou	0Ht2S9DavEqwd0MNu7lNIh	9	2001	0.574	0.618	0.962	2	-10.305	0	0.0473	0.862	0.681	0.0448	93.969	0.50425974393855	1.45666863069907	1	0.0	0.0	0.0	0.0	0.0	0.0	0.0	0.0	0.0	0.0	0.0	0.0	0.0	0.0	0.0	0.0				0.0	0.0
794	africa	HEX13950	HEX13950-0004	Sory Diabate	not found	Dimboré	5B9z8tzuRDusKjctuOGZ71	3	2014	0.732	0.862	0.72	2	-5.842	0	0.0338	0.107	0.0122	0.0696	111.953	1.57136092698717	0.308529994905758	1	1.0	1.0	0.0	0.0	0.0	0.0	0.0	1.0	0.0	0.0	0.0	0.0	0.0	0.0	0.0	0.0	Alegre	Facial_expressions Expectations_or_anticipations Emotion_is_contagious Fast_tempoFacial_expressions Feel_pleasure	Keep_beat_with_fingers_or_feet	0.9900990099009901	0.0
795	africa	KEX1218	KEX1218-0004	Kady Diarra	not found	Djiguya	0wrMBHKkIKNQ5z4HOVfOA6	0	                         2009-11-06	0.636	0.786	0.918	7	-7.48	1	0.0367	0.821	0.00149	0.093	123.545	1.23898514866055	1.24791615146392	1	0.0	0.0	0.0	0.0	0.0	0.0	0.0	0.0	0.0	0.0	0.0	0.0	0.0	0.0	0.0	0.0				0.0	0.0
796	africa	JK54106	JK54106-0005	Mory Kanté	not found	Faden	0HvHMHqlaiscddXRSFL4K5	5	                         1990-01-01	0.59	0.753	0.907	4	-11.577	0	0.0485	0.193	0.00148	0.0559	177.526	1.09466408701873	1.19572803165513	1	1.0	1.0	0.0	0.0	0.0	0.0	0.0	0.0	0.0	1.0	0.0	0.0	0.0	0.0	0.0	0.0	Poder	High_sound_levelTimbre Dissonance	Timbre High_sound_level	0.9900990099009901	0.0
797	africa	JK107880	JK107880-0007	Mory Kanté	not found	Wali Gnoumalombalia	5djsiqc8TERPfHy6wt853D	5	                         2009-06-30	0.832	0.675	0.765	5	-7.127	0	0.0545	0.218	7.42e-05	0.0617	106.001	0.753541577683514	0.522026848668977	1	7.0	5.0	0.0	0.0	2.0	1.0	0.0	5.0	0.0	0.0	0.0	0.0	1.0	0.0	0.0	0.0	relajada	Want_to_dance_or_move Harmony Keep_beat_with_fingers_or_feet Emotion_is_contagious Consonance Emotion_is_contagious Keep_beat_with_fingers_or_feet Keep_beat_with_fingers_or_feet Associations_to_a_thoughtFeel_pleasure Major_mode High_sound_level Emotion_is_contagious Harmony Associations_to_a_thought Harmony Note_durations	Feel_pleasure Emotion_is_contagious Music_is_stimulating Emotion_is_contagious Emotion_is_contagious Associations_to_a_thought Articulation_of_notes Consonance	0.5706134094151213	0.0
798	africa	KEX1229	KEX1229-0010	Samba Touré	not found	Goye	4nRkqq1JELZOCJbL3GZa34	1	                         2009-08-24	0.663	0.599	0.825	0	-13.222	1	0.114	0.262	0.000112	0.122	88.341	0.421165799356895	0.806689320353269	1	12.0	1.0	2.0	5.0	4.0	1.0	3.0	0.0	3.0	1.0	1.0	1.0	0.0	2.0	0.0	0.0	ceremonial amargura tensió Asombro alegre	Minor_mode Harmony Slow_tempo Slow_tempo Articulation_of_notes Minor_mode Associations_to_a_thought Associations_to_a_thought Slow_tempo Want_to_dance_or_move Articulation_of_notes Music_is_stimulating Changes_in_sound_level Note_durations DissonanceDissonance Melody_contour Slow_tempo Minor_mode Consonance Consonance Harmony Associations_to_a_thought Articulation_of_notes Keep_beat_with_fingers_or_feet Dissonance Dissonance Left_me_in_awe Dissonance	Minor_mode Lyrics Facial_expressions Expectations_or_anticipations Emotion_is_contagious Associations_to_a_thought Melody_contour Visualize_a_mental_image Dissonance Dissonance Tempo_variability Dissonance	0.08326394671107411	0.0
799	africa	HEX5421	HEX5421-0009	Fatou Guewel	not found	Mooda	05lArncCXvMB7f95cDRVTi	8	                         1998-06-01	0.588	0.804	0.913	2	-6.509	1	0.0558	0.638	0.0459	0.0497	103.12	1.31770572773791	1.22419427882356	1	7.0	7.0	0.0	0.0	0.0	0.0	0.0	7.0	0.0	0.0	0.0	0.0	0.0	0.0	0.0	0.0	festiva	High_sound_level Harmony Articulation_of_notes Keep_beat_with_fingers_or_feet Feel_pleasure Articulation_of_notes High_sound_level Want_to_dance_or_move Harmony Fast_tempo Fast_tempoMelody_contour High_sound_level Feel_pleasure Consonance Harmony Keep_beat_with_fingers_or_feet Harmony Melody_contour High_sound_level	Feel_like_singing Want_to_dance_or_move Music_is_stimulating Feel_pleasure Keep_beat_with_fingers_or_feet Emotion_is_contagious Harmony Emotion_is_contagious Articulation_of_notes me recuerda al verano	0.5706134094151213	0.14265335235378032
800	africa	HEX5372	HEX5372-0002	Kiné Lam	not found	Souma Sagnone	4Q6mVT6p581Y3n5L00pwWW	1	1996	0.77	0.863	0.724	11	-7.855	0	0.0571	0.141	0.0261	0.186	121.506	1.57573429249147	0.327507493018045	1	8.0	8.0	0.0	0.0	0.0	0.0	0.0	4.0	0.0	4.0	0.0	0.0	0.0	0.0	0.0	0.0		Consonance Timbre Want_to_dance_or_move Articulation_of_notes Fast_tempo Keep_beat_with_fingers_or_feet Articulation_of_notes Fast_tempo Want_to_dance_or_move Fast_tempo Want_to_dance_or_moveMajor_mode Keep_beat_with_fingers_or_feet Feel_like_singing High_sound_level Keep_beat_with_fingers_or_feet Consonance Harmony Want_to_dance_or_move Melody_contour Consonance	Music_is_stimulating Melody_contour Feel_like_singing Keep_beat_with_fingers_or_feet Feel_like_singing Keep_beat_with_fingers_or_feet Want_to_dance_or_move Harmony Keep_beat_with_fingers_or_feet	0.7490636704119851	0.12484394506866417
801	africa	HEX6794	HEX6794-0014	Oumou Dioubate	not found	Akafo	0rWM5wpSlXxVufYX6gmgsJ	23	                         1997-01-01	0.771	0.765	0.72	11	-5.501	0	0.0516	0.274	0.0	0.0836	113.377	1.1471444730703	0.308529994905758	1	7.0	7.0	0.0	0.0	0.0	0.0	0.0	7.0	0.0	0.0	0.0	0.0	0.0	0.0	0.0	0.0		Feel_pleasure Harmony Note_durations Keep_beat_with_fingers_or_feet Fast_tempo Articulation_of_notes Want_to_dance_or_move Articulation_of_notes Fast_tempoHigh_sound_level Melody_contour Major_mode Fast_tempo Consonance Want_to_dance_or_move Harmony Consonance	Articulation_of_notes Emotion_is_contagious Music_is_stimulating Want_to_dance_or_move Fast_tempo Emotion_is_contagious Harmony Feel_like_singing Want_to_dance_or_move Melody_contour Want_to_dance_or_move	0.7132667617689016	0.14265335235378032
802	africa	KEX1447	KEX1447-0003	Kandia Kouyate	not found	Kassi Doundo	6exS6oFxPzvlu9TdC1AipK	2	                         2015-01-01	0.642	0.738	0.512	4	-7.966	1	0.0862	0.531	1.89e-05	0.108	113.98	1.02906360445426	-0.67829990693312	2	2.0	0.0	2.0	0.0	0.0	0.0	0.0	0.0	0.0	0.0	1.0	1.0	0.0	0.0	0.0	0.0		Changes_in_sound_level Melody_contour Goosebumps_or_chillsChanges_in_sound_level Lyrics	Changes_in_sound_level Emotion_is_contagious	0.49751243781094534	0.0
803	africa	KEX0561	KEX0561-0002	Ali Farka Touré	not found	Allah Uya	5GhrRWZZez52XUAlZ3aHRE	28	                         1999-01-01	0.607	0.545	0.577	4	-11.564	1	0.107	0.873	0.00914	0.132	86.39	0.185004062124824	-0.36991556260847	2	7.0	5.0	0.0	1.0	1.0	0.0	1.0	3.0	0.0	0.0	0.0	0.0	1.0	0.0	0.0	2.0	danza sorpresa sorpresa alegría	Memories_of_somebody/something Harmony Slow_tempo Articulation_of_notes Melody_contour Harmony Articulation_of_notes Fast_tempo Melody_contour Feel_like_singing Fast_tempoMemories_of_somebody/something Feel_like_singing Articulation_of_notes Harmony Consonance Keep_beat_with_fingers_or_feet Note_durations Feel_like_singing Changes_in_sound_level Keep_beat_with_fingers_or_feet Music_is_stimulating	Memories_of_somebody/something Consonance Articulation_of_notes Keep_beat_with_fingers_or_feet Emotion_is_contagious High_sound_level Emotion_is_contagious Keep_beat_with_fingers_or_feet Feel_like_singing Keep_beat_with_fingers_or_feet Want_to_dance_or_move	0.42796005706134094	0.14265335235378032
804	africa	KEX1434	KEX1434-0004	Bassekou Kouyate	not found	Ayé Sira Bla	313OGD3ZgcMNSW78MIgLU2	6	                         2015-04-24	0.666	0.874	0.601	10	-4.11	0	0.0358	0.0318	0.0781	0.368	124.413	1.62384131303874	-0.256050573934754	2	2.0	2.0	0.0	0.0	0.0	0.0	0.0	2.0	0.0	0.0	0.0	0.0	0.0	0.0	0.0	0.0		Changes_in_sound_level Fast_tempo High_sound_level Articulation_of_notesChanges_in_sound_level Harmony Lyrics	Changes_in_sound_level Keep_beat_with_fingers_or_feet	0.9950248756218907	0.0
805	africa	KEX1420	KEX1420-0013	Mamy Kanoute	not found	Khontéla	2soB0LBJUMAn4u7mtLstAp	0	                         2014-06-03	0.594	0.662	0.463	11	-6.858	0	0.0416	0.733	0.0115	0.119	93.941	0.696687826127645	-0.910774258808625	2	2.0	2.0	0.0	0.0	0.0	0.0	0.0	2.0	0.0	0.0	0.0	0.0	0.0	0.0	0.0	0.0		Fast_tempo Melody_contour High_sound_levelFast_tempo Harmony Major_mode	Fast_tempo Keep_beat_with_fingers_or_feet	0.9950248756218907	0.49751243781094534
806	africa	HEX14006	HEX14006-0002	Oumou Sangaré	Tony Allen	Yere faga	2TdpGmTV28dk9XPJhHq1h1	35	                         2017-05-19	0.738	0.728	0.547	7	-6.949	1	0.0392	0.393	0.000199	0.409	104.989	0.985329949411288	-0.512246798450616	2	1.0	1.0	0.0	0.0	0.0	0.0	0.0	1.0	0.0	0.0	0.0	0.0	0.0	0.0	0.0	0.0		Fast_tempo Keep_beat_with_fingers_or_feetConsonance	Emotion_is_contagious Feel_like_singing	0.9900990099009901	0.0
807	africa	HEX13214	HEX13214-0001	Baaba Maal	not found	Fulani Rock	67RnI3Syy4piPmtHKS5F9d	17	                         2016-01-15	0.648	0.6	0.0827	1	-7.264	0	0.0826	0.0834	0.00245	0.114	128.961	0.425539164861193	-2.71505989183423	2	1.0	1.0	0.0	0.0	0.0	0.0	0.0	0.0	0.0	0.0	0.0	0.0	0.0	0.0	0.0	1.0	ritmica	High_sound_level Fast_tempoConsonance Expectations_or_anticipations	Emotion_is_contagious Timbre	0.9900990099009901	0.0
808	africa	KEX1229	KEX1229-0008	Samba Touré	not found	Goye Kurya	4WIzFllB9InVYo0XsuUbZI	1	                         2009-08-24	0.72	0.668	0.604	10	-10.206	0	0.039	0.0944	0.00292	0.0779	102.924	0.722928019153431	-0.241817450350539	2	0.0	0.0	0.0	0.0	0.0	0.0	0.0	0.0	0.0	0.0	0.0	0.0	0.0	0.0	0.0	0.0				0.0	0.0
809	africa	KEX1420	KEX1420-0005	Mamy Kanoute	not found	Daakan	7yMbwGcQpjvuMFDh0XYIlV	0	                         2014-06-03	0.621	0.603	0.614	2	-7.847	1	0.0609	0.702	4.15e-05	0.0957	87.812	0.438659261374086	-0.194373705069824	2	0.0	0.0	0.0	0.0	0.0	0.0	0.0	0.0	0.0	0.0	0.0	0.0	0.0	0.0	0.0	0.0				0.0	0.0
810	africa	KEX1420	KEX1420-0012	Mamy Kanoute	not found	Mousso Lou	32sUdQ1KHoaRXbhSat6r9t	0	                         2014-06-03	0.679	0.773	0.633	11	-7.646	0	0.0742	0.557	0.00692	0.355	146.893	1.18213139710468	-0.104230589036465	2	0.0	0.0	0.0	0.0	0.0	0.0	0.0	0.0	0.0	0.0	0.0	0.0	0.0	0.0	0.0	0.0				0.0	0.0
811	africa	KEX1325	KEX1325-0006	Sory Kandia Kouyaté	not found	Fouaba	7zYSB0n7ory2hZW2aokynA	1	                         1999-01-01	0.605	0.787	0.601	4	-1.959	1	0.0348	0.725	0.0274	0.0825	104.645	1.24335851416485	-0.256050573934754	2	0.0	0.0	0.0	0.0	0.0	0.0	0.0	0.0	0.0	0.0	0.0	0.0	0.0	0.0	0.0	0.0				0.0	0.0
812	africa	KEX1238	KEX1238-0003	Kandia Kouyate	not found	Bouka	652pCTWaUT7h0VSZTVRR8D	3	                         1993-01-01	0.712	0.534	0.481	5	-6.568	1	0.0341	0.815	8.56e-05	0.0984	126.621	0.13689704157755	-0.825375517303337	2	8.0	4.0	4.0	0.0	0.0	0.0	0.0	2.0	0.0	2.0	1.0	0.0	0.0	0.0	3.0	0.0	Agresiva	High_sound_level Changes_in_sound_level Articulation_of_notes Note_durations Articulation_of_notes Articulation_of_notes High_sound_level Music_is_stimulating Changes_in_sound_level Melody_contour Changes_in_sound_level Melody_contour Note_durations TimbreMinor_mode Melody_contour Changes_in_sound_level Articulation_of_notes Consonance Melody_contour Expectations_or_anticipations Timbre Facial_expressions Articulation_of_notes Associations_to_a_thought	Articulation_of_notes Facial_expressions Facial_expressions Articulation_of_notes Emotion_is_contagious Harmony Visualize_a_mental_image Harmony Memories_of_somebody/something Articulation_of_notes	0.37453183520599254	0.12484394506866417
813	africa	HEX1240	HEX1240-0001	Nahawa Doumbia	not found	Djina Mousso	7BX9k8fhSdv0QSGJxuB2d7	3	                         1987-01-01	0.748	0.555	0.512	4	-13.648	0	0.0766	0.251	0.00294	0.264	119.721	0.2287377171678	-0.67829990693312	2	8.0	7.0	0.0	0.0	1.0	1.0	0.0	4.0	0.0	2.0	0.0	0.0	0.0	0.0	0.0	1.0	celebración	Changes_in_sound_level Want_to_dance_or_move Articulation_of_notes Harmony Articulation_of_notes Articulation_of_notes Fast_tempo Associations_to_a_thought Fast_tempo HarmonyMajor_mode Melody_contour Major_mode Articulation_of_notes Harmony Melody_contour Associations_to_a_thought Articulation_of_notes Major_mode	Lyrics Feel_like_singing Want_to_dance_or_move Articulation_of_notes Keep_beat_with_fingers_or_feet Associations_to_a_thought Harmony Harmony	0.6242197253433208	0.12484394506866417
814	africa	KEX1440	KEX1440-0001	Seckou Keita	not found	Rewmi	6Wf42mzo2lJxy6mF1svY8g	2	                         2012-10-08	0.597	0.625	0.63	7	-10.391	0	0.103	0.715	0.000267	0.0639	139.343	0.534873302468633	-0.118463712620679	2	11.0	5.0	0.0	2.0	4.0	3.0	0.0	4.0	0.0	1.0	0.0	0.0	1.0	2.0	0.0	0.0	ceremonial pacifica cansament Alegría	Slow_tempo Slow_tempo Articulation_of_notes rythm Articulation_of_notes Fast_tempo Fast_tempo Changes_in_sound_level Timbre Timbre Conditioned Consonance Changes_in_sound_levelFeel_like_singing Melody_contour Major_mode rythm Harmony Facial_expressions Harmony Keep_beat_with_fingers_or_feet Articulation_of_notes Dissonance Changes_in_sound_level Left_me_in_awe	Harmony Harmony Feel_like_singing rythm Consonance Major_mode Facial_expressions Melody_contour Want_to_dance_or_move Articulation_of_notes Conditioned Feel_like_singing	0.36330608537693004	0.09082652134423251
